No.     Time           Source                Destination           Protocol Length Info
     27 4.167200       192.168.42.202        192.168.42.147        RTSP     187    OPTIONS rtsp://192.168.42.147:8554/vod/test.mp4 RTSP/1.0

Frame 27: 187 bytes on wire (1496 bits), 187 bytes captured (1496 bits)
Ethernet II, Src: 82:13:df:54:a3:61 (82:13:df:54:a3:61), Dst: VMware_a9:9a:db (00:0c:29:a9:9a:db)
Internet Protocol Version 4, Src: 192.168.42.202, Dst: 192.168.42.147
Transmission Control Protocol, Src Port: 56985, Dst Port: 8554, Seq: 1, Ack: 1, Len: 133
Real Time Streaming Protocol
    Request: OPTIONS rtsp://192.168.42.147:8554/vod/test.mp4 RTSP/1.0\r\n
    CSeq: 2\r\n
    User-Agent: LibVLC/3.0.8 (LIVE555 Streaming Media v2016.11.28)\r\n
    \r\n

No.     Time           Source                Destination           Protocol Length Info
     29 4.167544       192.168.42.147        192.168.42.202        RTSP     226    Reply: RTSP/1.0 200 OK

Frame 29: 226 bytes on wire (1808 bits), 226 bytes captured (1808 bits)
Ethernet II, Src: VMware_a9:9a:db (00:0c:29:a9:9a:db), Dst: 82:13:df:54:a3:61 (82:13:df:54:a3:61)
Internet Protocol Version 4, Src: 192.168.42.147, Dst: 192.168.42.202
Transmission Control Protocol, Src Port: 8554, Dst Port: 56985, Seq: 1, Ack: 134, Len: 172
Real Time Streaming Protocol
    Response: RTSP/1.0 200 OK\r\n
    CSeq: 2\r\n
    Date: Sun, 26 Apr 2020 17:07:53 GMT\r\n
    Public: DESCRIBE,SETUP,TEARDOWN,PLAY,PAUSE,ANNOUNCE,RECORD,GET_PARAMETER,SET_PARAMETER\r\n
    Content-length: 0
    \r\n

No.     Time           Source                Destination           Protocol Length Info
     30 4.171520       192.168.42.202        192.168.42.147        RTSP     213    DESCRIBE rtsp://192.168.42.147:8554/vod/test.mp4 RTSP/1.0

Frame 30: 213 bytes on wire (1704 bits), 213 bytes captured (1704 bits)
Ethernet II, Src: 82:13:df:54:a3:61 (82:13:df:54:a3:61), Dst: VMware_a9:9a:db (00:0c:29:a9:9a:db)
Internet Protocol Version 4, Src: 192.168.42.202, Dst: 192.168.42.147
Transmission Control Protocol, Src Port: 56985, Dst Port: 8554, Seq: 134, Ack: 173, Len: 159
Real Time Streaming Protocol
    Request: DESCRIBE rtsp://192.168.42.147:8554/vod/test.mp4 RTSP/1.0\r\n
    CSeq: 3\r\n
    User-Agent: LibVLC/3.0.8 (LIVE555 Streaming Media v2016.11.28)\r\n
    Accept: application/sdp\r\n
    \r\n

No.     Time           Source                Destination           Protocol Length Info
     32 4.172517       192.168.42.147        192.168.42.202        RTSP/SDP 663    Reply: RTSP/1.0 200 OK[Malformed Packet]

Frame 32: 663 bytes on wire (5304 bits), 663 bytes captured (5304 bits)
Ethernet II, Src: VMware_a9:9a:db (00:0c:29:a9:9a:db), Dst: 82:13:df:54:a3:61 (82:13:df:54:a3:61)
Internet Protocol Version 4, Src: 192.168.42.147, Dst: 192.168.42.202
Transmission Control Protocol, Src Port: 8554, Dst Port: 56985, Seq: 173, Ack: 293, Len: 609
Real Time Streaming Protocol
    Response: RTSP/1.0 200 OK\r\n
    CSeq: 3\r\n
    Date: Sun, 26 Apr 2020 17:07:53 GMT\r\n
    Content-type: application/sdp
    Content-length: 492
    \r\n
    Session Description Protocol

No.     Time           Source                Destination           Protocol Length Info
     33 4.211534       192.168.42.202        192.168.42.147        RTSP     244    SETUP rtsp://192.168.42.147:8554/vod/test.mp4/track1 RTSP/1.0

Frame 33: 244 bytes on wire (1952 bits), 244 bytes captured (1952 bits)
Ethernet II, Src: 82:13:df:54:a3:61 (82:13:df:54:a3:61), Dst: VMware_a9:9a:db (00:0c:29:a9:9a:db)
Internet Protocol Version 4, Src: 192.168.42.202, Dst: 192.168.42.147
Transmission Control Protocol, Src Port: 56985, Dst Port: 8554, Seq: 293, Ack: 782, Len: 190
Real Time Streaming Protocol
    Request: SETUP rtsp://192.168.42.147:8554/vod/test.mp4/track1 RTSP/1.0\r\n
    CSeq: 4\r\n
    User-Agent: LibVLC/3.0.8 (LIVE555 Streaming Media v2016.11.28)\r\n
    Transport: RTP/AVP;unicast;client_port=51300-51301
    \r\n

No.     Time           Source                Destination           Protocol Length Info
     35 4.212575       192.168.42.147        192.168.42.202        RTSP     239    Reply: RTSP/1.0 200 OK

Frame 35: 239 bytes on wire (1912 bits), 239 bytes captured (1912 bits)
Ethernet II, Src: VMware_a9:9a:db (00:0c:29:a9:9a:db), Dst: 82:13:df:54:a3:61 (82:13:df:54:a3:61)
Internet Protocol Version 4, Src: 192.168.42.147, Dst: 192.168.42.202
Transmission Control Protocol, Src Port: 8554, Dst Port: 56985, Seq: 782, Ack: 483, Len: 185
Real Time Streaming Protocol
    Response: RTSP/1.0 200 OK\r\n
    CSeq: 4\r\n
    Date: Sun, 26 Apr 2020 17:07:53 GMT\r\n
    Session: 0x7fa2b8028c60
    Transport: RTP/AVP;unicast;client_port=51300-51301;server_port=41550-41551
    Content-length: 0
    \r\n

No.     Time           Source                Destination           Protocol Length Info
     36 4.215479       192.168.42.202        192.168.42.147        RTSP     269    SETUP rtsp://192.168.42.147:8554/vod/test.mp4/track2 RTSP/1.0

Frame 36: 269 bytes on wire (2152 bits), 269 bytes captured (2152 bits)
Ethernet II, Src: 82:13:df:54:a3:61 (82:13:df:54:a3:61), Dst: VMware_a9:9a:db (00:0c:29:a9:9a:db)
Internet Protocol Version 4, Src: 192.168.42.202, Dst: 192.168.42.147
Transmission Control Protocol, Src Port: 56985, Dst Port: 8554, Seq: 483, Ack: 967, Len: 215
Real Time Streaming Protocol
    Request: SETUP rtsp://192.168.42.147:8554/vod/test.mp4/track2 RTSP/1.0\r\n
    CSeq: 5\r\n
    User-Agent: LibVLC/3.0.8 (LIVE555 Streaming Media v2016.11.28)\r\n
    Transport: RTP/AVP;unicast;client_port=51302-51303
    Session: 0x7fa2b8028c60
    \r\n

No.     Time           Source                Destination           Protocol Length Info
     37 4.215847       192.168.42.147        192.168.42.202        RTSP     239    Reply: RTSP/1.0 200 OK

Frame 37: 239 bytes on wire (1912 bits), 239 bytes captured (1912 bits)
Ethernet II, Src: VMware_a9:9a:db (00:0c:29:a9:9a:db), Dst: 82:13:df:54:a3:61 (82:13:df:54:a3:61)
Internet Protocol Version 4, Src: 192.168.42.147, Dst: 192.168.42.202
Transmission Control Protocol, Src Port: 8554, Dst Port: 56985, Seq: 967, Ack: 698, Len: 185
Real Time Streaming Protocol
    Response: RTSP/1.0 200 OK\r\n
    CSeq: 5\r\n
    Date: Sun, 26 Apr 2020 17:07:53 GMT\r\n
    Session: 0x7fa2b8028c60
    Transport: RTP/AVP;unicast;client_port=51302-51303;server_port=48236-48237
    Content-length: 0
    \r\n

No.     Time           Source                Destination           Protocol Length Info
     46 4.217738       192.168.42.202        192.168.42.147        RTSP     228    PLAY rtsp://192.168.42.147:8554/vod/test.mp4 RTSP/1.0

Frame 46: 228 bytes on wire (1824 bits), 228 bytes captured (1824 bits)
Ethernet II, Src: 82:13:df:54:a3:61 (82:13:df:54:a3:61), Dst: VMware_a9:9a:db (00:0c:29:a9:9a:db)
Internet Protocol Version 4, Src: 192.168.42.202, Dst: 192.168.42.147
Transmission Control Protocol, Src Port: 56985, Dst Port: 8554, Seq: 698, Ack: 1152, Len: 174
Real Time Streaming Protocol
    Request: PLAY rtsp://192.168.42.147:8554/vod/test.mp4 RTSP/1.0\r\n
    CSeq: 6\r\n
    User-Agent: LibVLC/3.0.8 (LIVE555 Streaming Media v2016.11.28)\r\n
    Session: 0x7fa2b8028c60
    Range: npt=0.000-\r\n
    \r\n

No.     Time           Source                Destination           Protocol Length Info
     47 4.217889       192.168.42.147        192.168.42.202        RTSP     352    Reply: RTSP/1.0 200 OK

Frame 47: 352 bytes on wire (2816 bits), 352 bytes captured (2816 bits)
Ethernet II, Src: VMware_a9:9a:db (00:0c:29:a9:9a:db), Dst: 82:13:df:54:a3:61 (82:13:df:54:a3:61)
Internet Protocol Version 4, Src: 192.168.42.147, Dst: 192.168.42.202
Transmission Control Protocol, Src Port: 8554, Dst Port: 56985, Seq: 1152, Ack: 872, Len: 298
Real Time Streaming Protocol
    Response: RTSP/1.0 200 OK\r\n
    CSeq: 6\r\n
    Date: Sun, 26 Apr 2020 17:07:53 GMT\r\n
    Session: 0x7fa2b8028c60
    Range: npt=0.000-\r\n
    RTP-Info: url=rtsp://192.168.42.147:8554/vod/test.mp4/track1;seq=22345;rtptime=1854875748,url=rtsp://192.168.42.147:8554/vod/test.mp4/track2;seq=3763;rtptime=1665603593\r\n
    Content-length: 0
    \r\n

No.     Time           Source                Destination           Protocol Length Info
     48 4.222965       192.168.42.147        192.168.42.202        RTCP     90     Sender Report   Source description   

Frame 48: 90 bytes on wire (720 bits), 90 bytes captured (720 bits)
Ethernet II, Src: VMware_a9:9a:db (00:0c:29:a9:9a:db), Dst: 82:13:df:54:a3:61 (82:13:df:54:a3:61)
Internet Protocol Version 4, Src: 192.168.42.147, Dst: 192.168.42.202
User Datagram Protocol, Src Port: 41551, Dst Port: 51301
Real-time Transport Control Protocol (Sender Report)
Real-time Transport Control Protocol (Source description)

No.     Time           Source                Destination           Protocol Length Info
     49 4.223129       192.168.42.147        192.168.42.202        RTCP     90     Sender Report   Source description   

Frame 49: 90 bytes on wire (720 bits), 90 bytes captured (720 bits)
Ethernet II, Src: VMware_a9:9a:db (00:0c:29:a9:9a:db), Dst: 82:13:df:54:a3:61 (82:13:df:54:a3:61)
Internet Protocol Version 4, Src: 192.168.42.147, Dst: 192.168.42.202
User Datagram Protocol, Src Port: 48237, Dst Port: 51303
Real-time Transport Control Protocol (Sender Report)
Real-time Transport Control Protocol (Source description)

No.     Time           Source                Destination           Protocol Length Info
    554 6.766091       192.168.42.202        192.168.42.147        RTCP     102    Receiver Report   Source description   

Frame 554: 102 bytes on wire (816 bits), 102 bytes captured (816 bits)
Ethernet II, Src: 82:13:df:54:a3:61 (82:13:df:54:a3:61), Dst: VMware_a9:9a:db (00:0c:29:a9:9a:db)
Internet Protocol Version 4, Src: 192.168.42.202, Dst: 192.168.42.147
User Datagram Protocol, Src Port: 51301, Dst Port: 41551
Real-time Transport Control Protocol (Receiver Report)
Real-time Transport Control Protocol (Source description)

No.     Time           Source                Destination           Protocol Length Info
    555 6.767977       192.168.42.202        192.168.42.147        RTCP     102    Receiver Report   Source description   

Frame 555: 102 bytes on wire (816 bits), 102 bytes captured (816 bits)
Ethernet II, Src: 82:13:df:54:a3:61 (82:13:df:54:a3:61), Dst: VMware_a9:9a:db (00:0c:29:a9:9a:db)
Internet Protocol Version 4, Src: 192.168.42.202, Dst: 192.168.42.147
User Datagram Protocol, Src Port: 51303, Dst Port: 48237
Real-time Transport Control Protocol (Receiver Report)
Real-time Transport Control Protocol (Source description)

No.     Time           Source                Destination           Protocol Length Info
    906 9.230289       192.168.42.147        192.168.42.202        RTCP     90     Sender Report   Source description   

Frame 906: 90 bytes on wire (720 bits), 90 bytes captured (720 bits)
Ethernet II, Src: VMware_a9:9a:db (00:0c:29:a9:9a:db), Dst: 82:13:df:54:a3:61 (82:13:df:54:a3:61)
Internet Protocol Version 4, Src: 192.168.42.147, Dst: 192.168.42.202
User Datagram Protocol, Src Port: 41551, Dst Port: 51301
Real-time Transport Control Protocol (Sender Report)
Real-time Transport Control Protocol (Source description)

No.     Time           Source                Destination           Protocol Length Info
    907 9.230525       192.168.42.147        192.168.42.202        RTCP     90     Sender Report   Source description   

Frame 907: 90 bytes on wire (720 bits), 90 bytes captured (720 bits)
Ethernet II, Src: VMware_a9:9a:db (00:0c:29:a9:9a:db), Dst: 82:13:df:54:a3:61 (82:13:df:54:a3:61)
Internet Protocol Version 4, Src: 192.168.42.147, Dst: 192.168.42.202
User Datagram Protocol, Src Port: 48237, Dst Port: 51303
Real-time Transport Control Protocol (Sender Report)
Real-time Transport Control Protocol (Source description)

No.     Time           Source                Destination           Protocol Length Info
   1070 10.447652      192.168.42.202        192.168.42.147        RTCP     82     Receiver Report   Goodbye   

Frame 1070: 82 bytes on wire (656 bits), 82 bytes captured (656 bits)
Ethernet II, Src: 82:13:df:54:a3:61 (82:13:df:54:a3:61), Dst: VMware_a9:9a:db (00:0c:29:a9:9a:db)
Internet Protocol Version 4, Src: 192.168.42.202, Dst: 192.168.42.147
User Datagram Protocol, Src Port: 51301, Dst Port: 41551
Real-time Transport Control Protocol (Receiver Report)
Real-time Transport Control Protocol (Goodbye)

No.     Time           Source                Destination           Protocol Length Info
   1071 10.447743      192.168.42.202        192.168.42.147        RTCP     82     Receiver Report   Goodbye   

Frame 1071: 82 bytes on wire (656 bits), 82 bytes captured (656 bits)
Ethernet II, Src: 82:13:df:54:a3:61 (82:13:df:54:a3:61), Dst: VMware_a9:9a:db (00:0c:29:a9:9a:db)
Internet Protocol Version 4, Src: 192.168.42.202, Dst: 192.168.42.147
User Datagram Protocol, Src Port: 51303, Dst Port: 48237
Real-time Transport Control Protocol (Receiver Report)
Real-time Transport Control Protocol (Goodbye)

No.     Time           Source                Destination           Protocol Length Info
   1072 10.448174      192.168.42.202        192.168.42.147        RTSP     213    TEARDOWN rtsp://192.168.42.147:8554/vod/test.mp4 RTSP/1.0

Frame 1072: 213 bytes on wire (1704 bits), 213 bytes captured (1704 bits)
Ethernet II, Src: 82:13:df:54:a3:61 (82:13:df:54:a3:61), Dst: VMware_a9:9a:db (00:0c:29:a9:9a:db)
Internet Protocol Version 4, Src: 192.168.42.202, Dst: 192.168.42.147
Transmission Control Protocol, Src Port: 56985, Dst Port: 8554, Seq: 872, Ack: 1450, Len: 159
Real Time Streaming Protocol
    Request: TEARDOWN rtsp://192.168.42.147:8554/vod/test.mp4 RTSP/1.0\r\n
    CSeq: 7\r\n
    User-Agent: LibVLC/3.0.8 (LIVE555 Streaming Media v2016.11.28)\r\n
    Session: 0x7fa2b8028c60
    \r\n

No.     Time           Source                Destination           Protocol Length Info
   1074 10.448368      192.168.42.147        192.168.42.202        RTSP     163    Reply: RTSP/1.0 200 OK

Frame 1074: 163 bytes on wire (1304 bits), 163 bytes captured (1304 bits)
Ethernet II, Src: VMware_a9:9a:db (00:0c:29:a9:9a:db), Dst: 82:13:df:54:a3:61 (82:13:df:54:a3:61)
Internet Protocol Version 4, Src: 192.168.42.147, Dst: 192.168.42.202
Transmission Control Protocol, Src Port: 8554, Dst Port: 56985, Seq: 1450, Ack: 1032, Len: 109
Real Time Streaming Protocol
    Response: RTSP/1.0 200 OK\r\n
    CSeq: 7\r\n
    Date: Sun, 26 Apr 2020 17:07:59 GMT\r\n
    Session: 0x7fa2b8028c60
    Content-length: 0
    \r\n
